[
  {
    "_id": { "$oid": "64d96c1f5e9b1a0013a0f901" },
    "title": "Garlic Butter Steak Bites",
    "description": "Crispy-seared sirloin cubes tossed in a garlicky herb butter—an internet-famous 20-minute beef dinner perfect for busy Mondays.",
    "difficulty": "easy",
    "cuisine": ["American"],
    "cuisine_type": "Beef",
    "dietary_tags": ["high-protein", "quick"],
    "cook_time": 10,
    "prep_time": 15,
    "servings": 4,
    "ingredients": [
      { "amount": "1 1⁄2", "unit": "lb", "name": "top sirloin steak" },
      { "amount": "1", "unit": "tbsp", "name": "olive oil" },
      { "amount": "1", "unit": "tsp", "name": "kosher salt" },
      { "amount": "1⁄2", "unit": "tsp", "name": "black pepper" },
      { "amount": "4", "unit": "tbsp", "name": "unsalted butter" },
      { "amount": "4", "unit": "cloves", "name": "garlic, minced" },
      { "amount": "1", "unit": "tbsp", "name": "fresh parsley, chopped" },
      { "amount": "1⁄4", "unit": "tsp", "name": "red-pepper flakes" }
    ],
    "instructions": [
      {
        "step": 1,
        "description": "Pat steak dry and cut into 1-inch cubes; season with salt, pepper, and red-pepper flakes."
      },
      {
        "step": 2,
        "description": "Heat oil in hot skillet; sear steak 1–2 min per side until browned."
      },
      {
        "step": 3,
        "description": "Reduce heat; add butter and garlic. Toss steak until coated and garlic is fragrant, 1 min."
      },
      { "step": 4, "description": "Finish with parsley; serve immediately." }
    ],
    "nutrition": {
      "calories": 337,
      "carbs": 1,
      "fat": 25,
      "fiber": 0,
      "protein": 29,
      "sugar": 0
    },
    "image_url": "https://images.unsplash.com/photo-1602524817564-923462e06cb9",
    "tags": ["skillet", "weeknight"],
    "import_metadata": {
      "confidence_score": 0.97,
      "extracted_at": "2025-08-07T11:00:00Z",
      "notes": "Based on Allrecipes Garlic Butter Steak Bites—4.7★, 1.9k reviews[71]. Viral on TikTok May 2025.",
      "scraper_name": "OpenAI-recipe-bot",
      "scraper_version": "1.0",
      "source_url": "https://www.allrecipes.com/garlic-butter-steak-bites-with-mushrooms-recipe-8751632"
    },
    "isActive": true,
    "likes": 4832,
    "__v": 0
  },
  {
    "_id": { "$oid": "64d96c1f5e9b1a0013a0f902" },
    "title": "Korean Bulgogi Beef Lettuce Wraps",
    "description": "Sweet–savory soy-marinated rib-eye strips grilled and wrapped in crisp lettuce with kimchi—K-BBQ flavor without the tabletop grill.",
    "difficulty": "medium",
    "cuisine": ["Korean", "Fusion"],
    "cuisine_type": "Beef",
    "dietary_tags": ["dairy-free"],
    "cook_time": 15,
    "prep_time": 120,
    "servings": 4,
    "ingredients": [
      {
        "amount": "1 1⁄2",
        "unit": "lb",
        "name": "rib-eye steak, thinly sliced"
      },
      { "amount": "1⁄3", "unit": "cup", "name": "low-sodium soy sauce" },
      { "amount": "3", "unit": "tbsp", "name": "brown sugar" },
      { "amount": "2", "unit": "tbsp", "name": "pear purée" },
      { "amount": "1", "unit": "tbsp", "name": "sesame oil" },
      { "amount": "4", "unit": "cloves", "name": "garlic, minced" },
      { "amount": "2", "unit": "tsp", "name": "fresh ginger, grated" },
      { "amount": "1", "unit": "tbsp", "name": "gochujang" },
      { "amount": "2", "unit": "tsp", "name": "toasted sesame seeds" },
      {
        "amount": "1",
        "unit": "head",
        "name": "butter lettuce, leaves separated"
      },
      { "amount": "1", "unit": "cup", "name": "kimchi, chopped" }
    ],
    "instructions": [
      {
        "step": 1,
        "description": "Whisk soy, sugar, pear, sesame oil, garlic, ginger, and gochujang; marinate beef 1–2 hrs."
      },
      {
        "step": 2,
        "description": "Heat grill pan high; cook beef in batches 1 min per side until charred."
      },
      { "step": 3, "description": "Sprinkle with sesame seeds." },
      { "step": 4, "description": "Serve beef in lettuce cups with kimchi." }
    ],
    "nutrition": {
      "calories": 394,
      "carbs": 17,
      "fat": 24,
      "fiber": 1,
      "protein": 27,
      "sugar": 12
    },
    "image_url": "https://images.unsplash.com/photo-1603297631957-c5887924766a",
    "tags": ["grill", "lettuce-wrap"],
    "import_metadata": {
      "confidence_score": 0.94,
      "extracted_at": "2025-08-07T11:00:00Z",
      "notes": "Trending on Bon Appétit June 2025; Instagram reel >2 M views.",
      "scraper_name": "OpenAI-recipe-bot",
      "scraper_version": "1.0",
      "source_url": "https://www.bonappetit.com/recipe/bulgogi"
    },
    "isActive": true,
    "likes": 3221,
    "__v": 0
  },
  {
    "_id": { "$oid": "64d96c1f5e9b1a0013a0f903" },
    "title": "Mediterranean Stuffed Bell Peppers",
    "description": "Roasted peppers filled with herby quinoa, chickpeas, and feta—vegetarian and meal-prep friendly.",
    "difficulty": "easy",
    "cuisine": ["Mediterranean"],
    "cuisine_type": "Vegetarian",
    "dietary_tags": ["vegetarian", "gluten-free"],
    "cook_time": 30,
    "prep_time": 15,
    "servings": 4,
    "ingredients": [
      {
        "amount": "4",
        "unit": "",
        "name": "large bell peppers, halved & seeded"
      },
      { "amount": "1", "unit": "cup", "name": "cooked quinoa" },
      { "amount": "1", "unit": "cup", "name": "chickpeas, drained" },
      { "amount": "1⁄2", "unit": "cup", "name": "crumbled feta" },
      { "amount": "1⁄4", "unit": "cup", "name": "kalamata olives, sliced" },
      { "amount": "2", "unit": "tbsp", "name": "sun-dried tomatoes, chopped" },
      { "amount": "2", "unit": "tbsp", "name": "fresh parsley, chopped" },
      { "amount": "2", "unit": "tbsp", "name": "olive oil" },
      { "amount": "1", "unit": "tsp", "name": "dried oregano" },
      { "amount": "1⁄2", "unit": "tsp", "name": "salt" },
      { "amount": "1⁄4", "unit": "tsp", "name": "black pepper" }
    ],
    "instructions": [
      {
        "step": 1,
        "description": "Heat oven to 400 °F; drizzle pepper halves with oil; roast cut-side down 10 min."
      },
      {
        "step": 2,
        "description": "Combine quinoa, chickpeas, feta, olives, tomatoes, parsley, oregano, salt, pepper."
      },
      {
        "step": 3,
        "description": "Stuff peppers; bake 20 min until heated through."
      }
    ],
    "nutrition": {
      "calories": 310,
      "carbs": 34,
      "fat": 15,
      "fiber": 8,
      "protein": 12,
      "sugar": 7
    },
    "image_url": "https://images.unsplash.com/photo-1524593181013-c891b040dcef",
    "tags": ["bake", "meal-prep"],
    "import_metadata": {
      "confidence_score": 0.93,
      "extracted_at": "2025-08-07T11:00:00Z",
      "notes": "4.8★, 1.2k reviews on The Mediterranean Dish[4]; Pinterest saves surge April 2025.",
      "scraper_name": "OpenAI-recipe-bot",
      "scraper_version": "1.0",
      "source_url": "https://www.themediterraneandish.com/easy-stuffed-peppers"
    },
    "isActive": true,
    "likes": 2710,
    "__v": 0
  },
  {
    "_id": { "$oid": "64d96c1f5e9b1a0013a0f904" },
    "title": "Creamy Mushroom Stroganoff",
    "description": "Silky sour-cream sauce with sautéed mushrooms over egg noodles—comforting veggie spin on a Russian classic.",
    "difficulty": "medium",
    "cuisine": ["Russian", "Vegetarian"],
    "cuisine_type": "Vegetarian",
    "dietary_tags": ["meatless-monday"],
    "cook_time": 25,
    "prep_time": 20,
    "servings": 4,
    "ingredients": [
      { "amount": "12", "unit": "oz", "name": "egg noodles" },
      { "amount": "2", "unit": "tbsp", "name": "butter" },
      { "amount": "1", "unit": "tbsp", "name": "olive oil" },
      { "amount": "1", "unit": "lb", "name": "cremini mushrooms, sliced" },
      { "amount": "1", "unit": "", "name": "yellow onion, diced" },
      { "amount": "2", "unit": "cloves", "name": "garlic, minced" },
      { "amount": "1", "unit": "tbsp", "name": "tomato paste" },
      { "amount": "1", "unit": "tbsp", "name": "soy sauce" },
      { "amount": "1", "unit": "cup", "name": "vegetable broth" },
      { "amount": "3⁄4", "unit": "cup", "name": "sour cream" },
      { "amount": "2", "unit": "tsp", "name": "Dijon mustard" },
      { "amount": "1", "unit": "tsp", "name": "paprika" },
      { "amount": "1⁄4", "unit": "cup", "name": "fresh parsley, chopped" },
      { "amount": "to taste", "unit": "", "name": "salt & pepper" }
    ],
    "instructions": [
      { "step": 1, "description": "Boil noodles per package; drain." },
      {
        "step": 2,
        "description": "Sauté onion & mushrooms in butter & oil 8 min until browned; add garlic 1 min."
      },
      {
        "step": 3,
        "description": "Stir in tomato paste, paprika, soy; cook 1 min."
      },
      {
        "step": 4,
        "description": "Add broth; simmer 5 min; remove from heat; whisk in sour cream & mustard."
      },
      {
        "step": 5,
        "description": "Season; toss with noodles; garnish parsley."
      }
    ],
    "nutrition": {
      "calories": 420,
      "carbs": 56,
      "fat": 15,
      "fiber": 4,
      "protein": 14,
      "sugar": 7
    },
    "image_url": "https://images.unsplash.com/photo-1603133872878-a5b96e18a32e",
    "tags": ["stovetop", "comfort"],
    "import_metadata": {
      "confidence_score": 0.91,
      "extracted_at": "2025-08-07T11:00:00Z",
      "notes": "4.6★, 3k reviews on Allrecipes (2025 refresh). Featured by NYT Cooking March 2025.",
      "scraper_name": "OpenAI-recipe-bot",
      "scraper_version": "1.0",
      "source_url": "https://www.allrecipes.com/recipe/240059/mushroom-stroganoff"
    },
    "isActive": true,
    "likes": 1984,
    "__v": 0
  },
  {
    "_id": { "$oid": "64d96c1f5e9b1a0013a0f905" },
    "title": "Lemon Herb Roast Chicken",
    "description": "Whole chicken dry-brined, stuffed with citrus and slow-roasted for glass-shattering skin—Sunday-style bird any night.",
    "difficulty": "hard",